[
  {
    "schema": "loomward.categoriser-record.v1",
    "synthetic": true,
    "record_id": "record-rust-build",
    "packet": {
      "schema": "loomward.evidence-packet.v1",
      "synthetic": true,
      "packet_id": "packet-rust-build",
      "group_id": "compiler-project",
      "observed_at": 1800000000,
      "subject": {
        "kind": "folder",
        "name_tokens": [
          "old",
          "compiler",
          "output"
        ],
        "depth": 2
      },
      "shape": {
        "files": 2000,
        "folders": 12,
        "logical_bytes": 900000000,
        "allocated_bytes": 900000000,
        "max_depth": 6
      },
      "families": [
        {
          "family": "executable",
          "share_files": 0.9,
          "share_bytes": 0.98
        },
        {
          "family": "code",
          "share_files": 0.1,
          "share_bytes": 0.02
        }
      ],
      "extensions": [
        {
          "ext": "rlib",
          "files": 2000,
          "bytes": 900000000
        }
      ],
      "markers": [
        "cargo_toml",
        "cargo_target_dir",
        "git_dir"
      ],
      "time": {
        "newest_content_write": 1700000000,
        "oldest_content_write": 1600000000,
        "newest_source_write": 1650000000,
        "newest_generated_write": 1700000000,
        "git_last_commit": 1640000000,
        "git_dirty": false,
        "last_access": "not_evidence"
      },
      "duplicates": {
        "duplicate_bytes": null,
        "groups": null
      },
      "media": null,
      "coverage": {
        "state": "complete",
        "allocation_known": true,
        "link_counts_observed": true,
        "online": true
      }
    },
    "human_labels": [
      {
        "axis": "meaning",
        "label": "generated_build"
      },
      {
        "axis": "lifecycle",
        "label": "dormant"
      },
      {
        "axis": "recreatability",
        "label": "generated"
      }
    ],
    "teacher_labels": [],
    "summary_facts": [
      "/markers",
      "/shape/logical_bytes",
      "/time/newest_content_write"
    ]
  },
  {
    "schema": "loomward.categoriser-record.v1",
    "synthetic": true,
    "record_id": "record-active-source",
    "packet": {
      "schema": "loomward.evidence-packet.v1",
      "synthetic": true,
      "packet_id": "packet-active-source",
      "group_id": "compiler-project",
      "observed_at": 1800000000,
      "subject": {
        "kind": "folder",
        "name_tokens": [
          "sample",
          "source",
          "project"
        ],
        "depth": 2
      },
      "shape": {
        "files": 100,
        "folders": 12,
        "logical_bytes": 1000000,
        "allocated_bytes": 1000000,
        "max_depth": 6
      },
      "families": [
        {
          "family": "code",
          "share_files": 1.0,
          "share_bytes": 1.0
        }
      ],
      "extensions": [
        {
          "ext": "rs",
          "files": 100,
          "bytes": 1000000
        }
      ],
      "markers": [
        "cargo_toml",
        "git_dir"
      ],
      "time": {
        "newest_content_write": 1799999900,
        "oldest_content_write": 1600000000,
        "newest_source_write": 1799999900,
        "newest_generated_write": null,
        "git_last_commit": 1799990000,
        "git_dirty": true,
        "last_access": "not_evidence"
      },
      "duplicates": {
        "duplicate_bytes": null,
        "groups": null
      },
      "media": null,
      "coverage": {
        "state": "complete",
        "allocation_known": true,
        "link_counts_observed": true,
        "online": true
      }
    },
    "human_labels": [
      {
        "axis": "meaning",
        "label": "source_project"
      },
      {
        "axis": "lifecycle",
        "label": "active"
      },
      {
        "axis": "recreatability",
        "label": "unique"
      }
    ],
    "teacher_labels": [],
    "summary_facts": [
      "/markers",
      "/shape/logical_bytes",
      "/time/newest_content_write"
    ]
  },
  {
    "schema": "loomward.categoriser-record.v1",
    "synthetic": true,
    "record_id": "record-dependencies",
    "packet": {
      "schema": "loomward.evidence-packet.v1",
      "synthetic": true,
      "packet_id": "packet-dependencies",
      "group_id": "web-project",
      "observed_at": 1800000000,
      "subject": {
        "kind": "folder",
        "name_tokens": [
          "sample",
          "dependencies"
        ],
        "depth": 2
      },
      "shape": {
        "files": 8000,
        "folders": 12,
        "logical_bytes": 300000000,
        "allocated_bytes": 300000000,
        "max_depth": 6
      },
      "families": [
        {
          "family": "code",
          "share_files": 1.0,
          "share_bytes": 1.0
        }
      ],
      "extensions": [
        {
          "ext": "js",
          "files": 8000,
          "bytes": 300000000
        }
      ],
      "markers": [
        "package_json",
        "node_modules_dir",
        "pnpm_lock"
      ],
      "time": {
        "newest_content_write": 1700000000,
        "oldest_content_write": 1600000000,
        "newest_source_write": null,
        "newest_generated_write": null,
        "git_last_commit": null,
        "git_dirty": null,
        "last_access": "not_evidence"
      },
      "duplicates": {
        "duplicate_bytes": null,
        "groups": null
      },
      "media": null,
      "coverage": {
        "state": "complete",
        "allocation_known": true,
        "link_counts_observed": true,
        "online": true
      }
    },
    "human_labels": [
      {
        "axis": "meaning",
        "label": "dependency_install"
      },
      {
        "axis": "lifecycle",
        "label": "active"
      },
      {
        "axis": "recreatability",
        "label": "redownloadable"
      }
    ],
    "teacher_labels": [],
    "summary_facts": [
      "/markers",
      "/shape/logical_bytes",
      "/time/newest_content_write"
    ]
  },
  {
    "schema": "loomward.categoriser-record.v1",
    "synthetic": true,
    "record_id": "record-package-cache",
    "packet": {
      "schema": "loomward.evidence-packet.v1",
      "synthetic": true,
      "packet_id": "packet-package-cache",
      "group_id": "package-store",
      "observed_at": 1800000000,
      "subject": {
        "kind": "folder",
        "name_tokens": [
          "shared",
          "package",
          "cache"
        ],
        "depth": 2
      },
      "shape": {
        "files": 100,
        "folders": 12,
        "logical_bytes": 1000000,
        "allocated_bytes": 1000000,
        "max_depth": 6
      },
      "families": [
        {
          "family": "archive",
          "share_files": 1.0,
          "share_bytes": 1.0
        }
      ],
      "extensions": [
        {
          "ext": "tgz",
          "files": 100,
          "bytes": 1000000
        }
      ],
      "markers": [
        "cachedir_tag",
        "archive_files"
      ],
      "time": {
        "newest_content_write": 1700000000,
        "oldest_content_write": 1600000000,
        "newest_source_write": null,
        "newest_generated_write": null,
        "git_last_commit": null,
        "git_dirty": null,
        "last_access": "not_evidence"
      },
      "duplicates": {
        "duplicate_bytes": null,
        "groups": null
      },
      "media": null,
      "coverage": {
        "state": "complete",
        "allocation_known": true,
        "link_counts_observed": true,
        "online": true
      }
    },
    "human_labels": [
      {
        "axis": "meaning",
        "label": "package_cache"
      },
      {
        "axis": "lifecycle",
        "label": "dormant"
      },
      {
        "axis": "recreatability",
        "label": "redownloadable"
      }
    ],
    "teacher_labels": [],
    "summary_facts": [
      "/markers",
      "/shape/logical_bytes",
      "/time/newest_content_write"
    ]
  },
  {
    "schema": "loomward.categoriser-record.v1",
    "synthetic": true,
    "record_id": "record-model-store",
    "packet": {
      "schema": "loomward.evidence-packet.v1",
      "synthetic": true,
      "packet_id": "packet-model-store",
      "group_id": "model-library",
      "observed_at": 1800000000,
      "subject": {
        "kind": "folder",
        "name_tokens": [
          "sample",
          "model",
          "store"
        ],
        "depth": 2
      },
      "shape": {
        "files": 2,
        "folders": 12,
        "logical_bytes": 8000000000,
        "allocated_bytes": 8000000000,
        "max_depth": 6
      },
      "families": [
        {
          "family": "model",
          "share_files": 1.0,
          "share_bytes": 1.0
        }
      ],
      "extensions": [
        {
          "ext": "gguf",
          "files": 2,
          "bytes": 8000000000
        }
      ],
      "markers": [
        "gguf_file",
        "lmstudio_models_layout"
      ],
      "time": {
        "newest_content_write": 1700000000,
        "oldest_content_write": 1600000000,
        "newest_source_write": null,
        "newest_generated_write": null,
        "git_last_commit": null,
        "git_dirty": null,
        "last_access": "not_evidence"
      },
      "duplicates": {
        "duplicate_bytes": null,
        "groups": null
      },
      "media": null,
      "coverage": {
        "state": "complete",
        "allocation_known": true,
        "link_counts_observed": true,
        "online": true
      }
    },
    "human_labels": [
      {
        "axis": "meaning",
        "label": "model_weights"
      },
      {
        "axis": "lifecycle",
        "label": "dormant"
      },
      {
        "axis": "recreatability",
        "label": "redownloadable"
      }
    ],
    "teacher_labels": [
      {
        "axis": "meaning",
        "label": "archive"
      }
    ],
    "summary_facts": [
      "/markers",
      "/shape/logical_bytes",
      "/time/newest_content_write"
    ]
  },
  {